{
    "$schema": "./config.schema.json",
    "directory": "/home/bpannell/dev",
    "scratchpads": "/home/bpannell/scratch",
    "apps": [
        {
            "name": "shell",
            "command": "pwsh"
        }
    ],
    "services": [
        {
            "name": "gh",
            "website": "https://github.com/{{ .Repo.FullName }}",
            "gitUrl": "git@github.com:{{ .Repo.FullName }}.git",
            "pattern": "*/*",
            "api": {
                "kind": "GitHub/v3",
                "url": "https://api.github.com"
            }
        }
    ],
    "aliases": {
        "gt": "github.com/SierraSoftworks/git-tool"
    },
    "features": {
        "http_transport": true,
        "telemetry": false
    }
}